{
  "$schema": "../../../docs/content/schema/deck.schema.json",
  "kind": "deck",
  "id": "arithmetic_grid.deck.aviation-conversions",
  "version": 1,
  "moduleId": "psy0",
  "familyId": "arithmetic_grid",
  "order": 1,
  "name": { "fr": "Conversions aéronautiques", "en": "Aviation conversions" },
  "description": { "fr": "Les facteurs de conversion à connaître par cœur pour le calcul mental.", "en": "Conversion factors to know by heart for mental arithmetic." },
  "tags": ["arith.aviation", "arith.aviation.conversion"],
  "cards": [
    {
      "id": "arithmetic_grid.deck.aviation-conversions.0001",
      "version": 1,
      "deckId": "arithmetic_grid.deck.aviation-conversions",
      "front": { "fr": "1 NM = ? km", "en": "1 NM = ? km" },
      "back": { "fr": "**1,852 km** (≈ 1,85). Astuce : NM → km ≈ × 2 − 8 %.", "en": "**1.852 km** (about 1.85). Trick: NM to km is roughly × 2 minus 8 %." },
      "difficulty": 1,
      "tags": ["arith.aviation.conversion"]
    },
    {
      "id": "arithmetic_grid.deck.aviation-conversions.0002",
      "version": 1,
      "deckId": "arithmetic_grid.deck.aviation-conversions",
      "front": { "fr": "1 000 ft = ? m", "en": "1,000 ft = ? m" },
      "back": { "fr": "**≈ 305 m** (1 ft = 0,3048 m). De tête : × 0,3 puis + 5 %.", "en": "**about 305 m** (1 ft = 0.3048 m). Mentally: × 0.3 then + 5 %." },
      "difficulty": 2,
      "tags": ["arith.aviation.conversion"]
    },
    {
      "id": "arithmetic_grid.deck.aviation-conversions.0003",
      "version": 1,
      "deckId": "arithmetic_grid.deck.aviation-conversions",
      "front": { "fr": "60 kt = ? NM par minute", "en": "60 kt = ? NM per minute" },
      "back": { "fr": "**1 NM/min**. Donc V kt = V ÷ 60 NM/min : 420 kt → 7 NM/min.", "en": "**1 NM/min**. So S kt = S / 60 NM/min: 420 kt → 7 NM/min." },
      "difficulty": 1,
      "tags": ["arith.aviation.speed_distance"]
    }
  ]
}
