{
  "$schema": "../../../../docs/content/schema/deck.schema.json",
  "kind": "deck",
  "id": "logic_dominos.deck.modulo7",
  "version": 1,
  "moduleId": "psy0",
  "familyId": "logic_dominos",
  "order": 1,
  "name": {
    "fr": "Motifs modulo 7",
    "en": "Modulo-7 patterns"
  },
  "description": {
    "fr": "Suites arithmétiques et motifs modulo 7 pour repérer rapidement la case manquante des dominos.",
    "en": "Arithmetic sequences and modulo-7 patterns to quickly spot the missing domino."
  },
  "tags": [
    "logic"
  ],
  "cards": [
    {
      "id": "logic_dominos.deck.modulo7.0001",
      "version": 1,
      "deckId": "logic_dominos.deck.modulo7",
      "front": {
        "fr": "Suite : 3, 10, 17, 24, ... ? (pas constant)",
        "en": "Sequence: 3, 10, 17, 24, ... ? (constant step)"
      },
      "back": {
        "fr": "**31** (chaque terme = précédent + 7 ; motif modulo 7).",
        "en": "**31** (each term = previous + 7; modulo-7 pattern)."
      },
      "difficulty": 2,
      "tags": [
        "logic.modulo7.arithmetic_sequence"
      ]
    },
    {
      "id": "logic_dominos.deck.modulo7.0002",
      "version": 1,
      "deckId": "logic_dominos.deck.modulo7",
      "front": {
        "fr": "Suite : 2, 9, 16, 23, 30, ... ? (pas constant)",
        "en": "Sequence: 2, 9, 16, 23, 30, ... ? (constant step)"
      },
      "back": {
        "fr": "**37** (chaque terme = précédent + 7 ; motif modulo 7).",
        "en": "**37** (each term = previous + 7; modulo-7 pattern)."
      },
      "difficulty": 2,
      "tags": [
        "logic.modulo7.arithmetic_sequence"
      ]
    },
    {
      "id": "logic_dominos.deck.modulo7.0003",
      "version": 1,
      "deckId": "logic_dominos.deck.modulo7",
      "front": {
        "fr": "Suite : 1, 8, 15, 22, 29, 36, ... ? (pas constant)",
        "en": "Sequence: 1, 8, 15, 22, 29, 36, ... ? (constant step)"
      },
      "back": {
        "fr": "**43** (chaque terme = précédent + 7 ; motif modulo 7).",
        "en": "**43** (each term = previous + 7; modulo-7 pattern)."
      },
      "difficulty": 2,
      "tags": [
        "logic.modulo7.arithmetic_sequence"
      ]
    },
    {
      "id": "logic_dominos.deck.modulo7.0004",
      "version": 1,
      "deckId": "logic_dominos.deck.modulo7",
      "front": {
        "fr": "Suite : 5, 12, 19, ... ? (pas constant)",
        "en": "Sequence: 5, 12, 19, ... ? (constant step)"
      },
      "back": {
        "fr": "**26** (chaque terme = précédent + 7 ; motif modulo 7).",
        "en": "**26** (each term = previous + 7; modulo-7 pattern)."
      },
      "difficulty": 2,
      "tags": [
        "logic.modulo7.arithmetic_sequence"
      ]
    },
    {
      "id": "logic_dominos.deck.modulo7.0005",
      "version": 1,
      "deckId": "logic_dominos.deck.modulo7",
      "front": {
        "fr": "Suite : 6, 13, ... ? (pas constant)",
        "en": "Sequence: 6, 13, ... ? (constant step)"
      },
      "back": {
        "fr": "**20** (chaque terme = précédent + 7 ; motif modulo 7).",
        "en": "**20** (each term = previous + 7; modulo-7 pattern)."
      },
      "difficulty": 2,
      "tags": [
        "logic.modulo7.arithmetic_sequence"
      ]
    },
    {
      "id": "logic_dominos.deck.modulo7.0006",
      "version": 1,
      "deckId": "logic_dominos.deck.modulo7",
      "front": {
        "fr": "Suite décroissante : 30, 23, 16, 9, ... ?",
        "en": "Decreasing sequence: 30, 23, 16, 9, ... ?"
      },
      "back": {
        "fr": "**2** (chaque terme = précédent − 7).",
        "en": "**2** (each term = previous − 7)."
      },
      "difficulty": 2,
      "tags": [
        "logic.modulo7.arithmetic_sequence"
      ]
    },
    {
      "id": "logic_dominos.deck.modulo7.0007",
      "version": 1,
      "deckId": "logic_dominos.deck.modulo7",
      "front": {
        "fr": "Suite décroissante : 28, 21, 14, ... ?",
        "en": "Decreasing sequence: 28, 21, 14, ... ?"
      },
      "back": {
        "fr": "**7** (chaque terme = précédent − 7).",
        "en": "**7** (each term = previous − 7)."
      },
      "difficulty": 2,
      "tags": [
        "logic.modulo7.arithmetic_sequence"
      ]
    },
    {
      "id": "logic_dominos.deck.modulo7.0008",
      "version": 1,
      "deckId": "logic_dominos.deck.modulo7",
      "front": {
        "fr": "Suite décroissante : 35, 28, 21, 14, ... ?",
        "en": "Decreasing sequence: 35, 28, 21, 14, ... ?"
      },
      "back": {
        "fr": "**7** (chaque terme = précédent − 7).",
        "en": "**7** (each term = previous − 7)."
      },
      "difficulty": 2,
      "tags": [
        "logic.modulo7.arithmetic_sequence"
      ]
    },
    {
      "id": "logic_dominos.deck.modulo7.0009",
      "version": 1,
      "deckId": "logic_dominos.deck.modulo7",
      "front": {
        "fr": "Quel est le reste de 23 divisé par 7 ?",
        "en": "What is the remainder of 23 divided by 7?"
      },
      "back": {
        "fr": "**2** (23 = 3 × 7 + 2).",
        "en": "**2** (23 = 3 × 7 + 2)."
      },
      "difficulty": 3,
      "tags": [
        "logic.modulo7.remainder"
      ]
    },
    {
      "id": "logic_dominos.deck.modulo7.0010",
      "version": 1,
      "deckId": "logic_dominos.deck.modulo7",
      "front": {
        "fr": "Quel est le reste de 30 divisé par 7 ?",
        "en": "What is the remainder of 30 divided by 7?"
      },
      "back": {
        "fr": "**2** (30 = 4 × 7 + 2).",
        "en": "**2** (30 = 4 × 7 + 2)."
      },
      "difficulty": 3,
      "tags": [
        "logic.modulo7.remainder"
      ]
    },
    {
      "id": "logic_dominos.deck.modulo7.0011",
      "version": 1,
      "deckId": "logic_dominos.deck.modulo7",
      "front": {
        "fr": "Quel est le reste de 45 divisé par 7 ?",
        "en": "What is the remainder of 45 divided by 7?"
      },
      "back": {
        "fr": "**3** (45 = 6 × 7 + 3).",
        "en": "**3** (45 = 6 × 7 + 3)."
      },
      "difficulty": 3,
      "tags": [
        "logic.modulo7.remainder"
      ]
    },
    {
      "id": "logic_dominos.deck.modulo7.0012",
      "version": 1,
      "deckId": "logic_dominos.deck.modulo7",
      "front": {
        "fr": "Quel est le reste de 50 divisé par 7 ?",
        "en": "What is the remainder of 50 divided by 7?"
      },
      "back": {
        "fr": "**1** (50 = 7 × 7 + 1).",
        "en": "**1** (50 = 7 × 7 + 1)."
      },
      "difficulty": 3,
      "tags": [
        "logic.modulo7.remainder"
      ]
    },
    {
      "id": "logic_dominos.deck.modulo7.0013",
      "version": 1,
      "deckId": "logic_dominos.deck.modulo7",
      "front": {
        "fr": "Quel est le reste de 61 divisé par 7 ?",
        "en": "What is the remainder of 61 divided by 7?"
      },
      "back": {
        "fr": "**5** (61 = 8 × 7 + 5).",
        "en": "**5** (61 = 8 × 7 + 5)."
      },
      "difficulty": 3,
      "tags": [
        "logic.modulo7.remainder"
      ]
    },
    {
      "id": "logic_dominos.deck.modulo7.0014",
      "version": 1,
      "deckId": "logic_dominos.deck.modulo7",
      "front": {
        "fr": "Quel est le reste de 69 divisé par 7 ?",
        "en": "What is the remainder of 69 divided by 7?"
      },
      "back": {
        "fr": "**6** (69 = 9 × 7 + 6).",
        "en": "**6** (69 = 9 × 7 + 6)."
      },
      "difficulty": 3,
      "tags": [
        "logic.modulo7.remainder"
      ]
    },
    {
      "id": "logic_dominos.deck.modulo7.0015",
      "version": 1,
      "deckId": "logic_dominos.deck.modulo7",
      "front": {
        "fr": "Méthode dominos : comment repérer le motif d'une rangée ?",
        "en": "Domino method: how to spot a row's pattern?"
      },
      "back": {
        "fr": "Calcule la **différence entre chaque case adjacente** ; si elle est constante (souvent liée à 7), la case manquante suit la même règle.",
        "en": "Compute the **difference between adjacent cells**; if constant (often tied to 7), the missing cell follows the same rule."
      },
      "difficulty": 2,
      "tags": [
        "logic.modulo7.method"
      ]
    },
    {
      "id": "logic_dominos.deck.modulo7.0016",
      "version": 1,
      "deckId": "logic_dominos.deck.modulo7",
      "front": {
        "fr": "Méthode dominos : que faire si la différence change de signe ?",
        "en": "Domino method: what if the difference changes sign?"
      },
      "back": {
        "fr": "Vérifie une alternance (+7 puis −7, ou ×2 puis −7) : les dominos combinent parfois deux règles simples.",
        "en": "Check for alternation (+7 then −7, or ×2 then −7): dominoes sometimes combine two simple rules."
      },
      "difficulty": 2,
      "tags": [
        "logic.modulo7.method"
      ]
    },
    {
      "id": "logic_dominos.deck.modulo7.0017",
      "version": 1,
      "deckId": "logic_dominos.deck.modulo7",
      "front": {
        "fr": "Astuce modulo 7 : pourquoi ce nombre revient-il souvent dans les dominos ?",
        "en": "Modulo-7 trick: why does 7 recur in domino puzzles?"
      },
      "back": {
        "fr": "7 est le nombre de points maximum par moitié de domino classique : les motifs « bouclent » naturellement modulo 7.",
        "en": "7 is the max pip count per half of a classic domino: patterns naturally \"wrap\" modulo 7."
      },
      "difficulty": 2,
      "tags": [
        "logic.modulo7.method"
      ]
    }
  ]
}
